Unnamed: 0,UNNAMED: 0,ASSET_NAME,ASSET_ID,ASSET_TYPE,OPERATING_STATUS,POOL_PARTICIPANT_NAME,POOL_PARTICIPANT_ID,NET_TO_GRID_ASSET_FLAG,ASSET_INCL_STORAGE_FLAG,REGION,TYPE,POOL_ID
89,89,ABCP APC BC IMPORT,ABCP,SOURCE,Active,Heartland Generation 1,APC,,,,,
93,93,ABSK APC SK IMPORT,ABSK,SOURCE,Active,Heartland Generation 1,APC,,,,,
96,96,ACBC BC IMPORT UNIT,ACBC,SOURCE,Retired,Aquila Canada Corp.,ACC,,,,,
99,99,ACC EXPORT TO BCH #0,ACE0,SINK,Retired,Aquila Canada Corp.,ACC,,,,,
100,100,ACE1 ACC EXPORT TO BCH #1,ACE1,SINK,Retired,Aquila Canada Corp.,ACC,,,,,
101,101,ACE2 ACC EXPORT TO BCH #2,ACE2,SINK,Retired,Aquila Canada Corp.,ACC,,,,,
102,102,ACE3 ACC EXPORT TO BCH #3,ACE3,SINK,Retired,Aquila Canada Corp.,ACC,,,,,
103,103,ACE4 ACC EXPORT TO BCH #4,ACE4,SINK,Retired,Aquila Canada Corp.,ACC,,,,,
104,104,ACE5 ACC EXPORT TO BCH #5,ACE5,SINK,Retired,Aquila Canada Corp.,ACC,,,,,
105,105,ACE6 ACC EXPORT TO BCH #6,ACE6,SINK,Retired,Aquila Canada Corp.,ACC,,,,,
106,106,ACE7 ACC EXPORT TO BCH #7,ACE7,SINK,Retired,Aquila Canada Corp.,ACC,,,,,
107,107,ACC EXPORT TO BCH #8,ACE8,SINK,Retired,Aquila Canada Corp.,ACC,,,,,
108,108,ACC EXPORT TO BCH #9,ACE9,SINK,Retired,Aquila Canada Corp.,ACC,,,,,
109,109,ACEA ACC EXPORT TO SPC #A,ACEA,SINK,Retired,Aquila Canada Corp.,ACC,,,,,
110,110,ACEB ACC EXPORT TO SPC #B,ACEB,SINK,Retired,Aquila Canada Corp.,ACC,,,,,
111,111,ACEC ACC EXPORT TO SPC #C,ACEC,SINK,Retired,Aquila Canada Corp.,ACC,,,,,
112,112,ACC IMPORT FROM BCH #0,ACI0,SOURCE,Retired,Aquila Canada Corp.,ACC,,,,,
113,113,ACC IMPORT FROM BCH #1,ACI1,SOURCE,Retired,Aquila Canada Corp.,ACC,,,,,
114,114,ACC IMPORT FROM BCH #2,ACI2,SOURCE,Retired,Aquila Canada Corp.,ACC,,,,,
115,115,ACC IMPORT FROM BCH #3,ACI3,SOURCE,Retired,Aquila Canada Corp.,ACC,,,,,
116,116,ACC IMPORT FROM BCH #4,ACI4,SOURCE,Retired,Aquila Canada Corp.,ACC,,,,,
117,117,ACC IMPORT FROM BCH #5,ACI5,SOURCE,Retired,Aquila Canada Corp.,ACC,,,,,
118,118,ACC IMPORT FROM BCH #6,ACI6,SOURCE,Retired,Aquila Canada Corp.,ACC,,,,,
119,119,ACC IMPORT FROM BCH #7,ACI7,SOURCE,Retired,Aquila Canada Corp.,ACC,,,,,
120,120,ACC IMPORT FROM BCH #8,ACI8,SOURCE,Retired,Aquila Canada Corp.,ACC,,,,,
121,121,ACC IMPORT FROM BCH #9,ACI9,SOURCE,Retired,Aquila Canada Corp.,ACC,,,,,
122,122,ACC IMPORT FROM SPC #A,ACIA,SOURCE,Retired,Aquila Canada Corp.,ACC,,,,,
123,123,ACC IMPORT FROM SPC #B,ACIB,SOURCE,Retired,Aquila Canada Corp.,ACC,,,,,
124,124,ACC IMPORT FROM SPC #C,ACIC,SOURCE,Retired,Aquila Canada Corp.,ACC,,,,,
128,128,ACSK SASK IMPORT UNIT,ACSK,SOURCE,Retired,Aquila Canada Corp.,ACC,,,,,
140,140,AEBC AEI BC IMPORT,AEBC,SOURCE,Retired,Avista Energy Inc.,AEI,,,,,
149,149,AEXB AEI BC EXPORT,AEXB,SINK,Retired,Avista Energy Inc.,AEI,,,,,
217,217,APBC BC IMPORT UNIT,APBC,SOURCE,Retired,ATCO Electric,APL,,,,,
222,222,APL IMPORT FROM SPC,API1,SOURCE,Retired,ATCO Electric,APL,,,,,
223,223,APL IMPORT FROM BCH,API2,SOURCE,Retired,ATCO Electric,APL,,,,,
224,224,APL IMPORT FROM SPC,API3,SOURCE,Retired,ATCO Electric,APL,,,,,
229,229,APMT APC MT IMPORT,APMT,SOURCE,Active,Heartland Generation 1,APC,,,,,
238,238,APSK SASK IMPORT UNIT,APSK,SOURCE,Retired,ATCO Electric,APL,,,,,
240,240,APX1 APL EXPORT TO SPC,APX1,SINK,Retired,ATCO Electric,APL,,,,,
241,241,APX2 APL EXPORT TO SPC,APX2,SINK,Retired,ATCO Electric,APL,,,,,
242,242,APX3 APL EXPORT TO SPC,APX3,SINK,Retired,ATCO Electric,APL,,,,,
243,243,APX4 APL EXPORT TO SPC,APX4,SINK,Retired,ATCO Electric,APL,,,,,
244,244,APX5 APL EXPORT TO BCH,APX5,SINK,Retired,ATCO Electric,APL,,,,,
245,245,APX6 APL EXPORT TO BCH,APX6,SINK,Retired,ATCO Electric,APL,,,,,
246,246,APX7 APL EXPORT TO BCH,APX7,SINK,Retired,ATCO Electric,APL,,,,,
247,247,APX8 APL EXPORT TO BCH,APX8,SINK,Retired,ATCO Electric,APL,,,,,
248,248,APXB APC BC EXPORT,APXB,SINK,Active,Heartland Generation 1,APC,,,,,
249,249,APXM APC MT EXPORT,APXM,SINK,Active,Heartland Generation 1,APC,,,,,
250,250,APXS APC SK EXPORT,APXS,SINK,Active,Heartland Generation 1,APC,,,,,
256,256,AQBC AQP BC IMPORT,AQBC,SOURCE,Retired,Aquilon Power Silverhill Fund L.P.,AQP,,,,,
257,257,AQSK AQP SASK IMPORT,AQSK,SOURCE,Retired,Aquilon Power Silverhill Fund L.P.,AQP,,,,,
259,259,AQXB AQP EXPORT TO BC,AQXB,SINK,Retired,Aquilon Power Silverhill Fund L.P.,AQP,,,,,
260,260,AQXS AQP EXPORT TO SASK,AQXS,SINK,Retired,Aquilon Power Silverhill Fund L.P.,AQP,,,,,
297,297,ATBC ATPC IMPORT FROM BC,ATBC,SOURCE,Retired,ATCO Power Canada Ltd.,ATPC,,,,,
300,300,ATSK ATPC IMPORT FROM SASK,ATSK,SOURCE,Retired,ATCO Power Canada Ltd.,ATPC,,,,,
301,301,ATXB ATPC EXPORT TO BC,ATXB,SINK,Retired,ATCO Power Canada Ltd.,ATPC,,,,,
302,302,ATXS ATPC EXPORT TO SASK,ATXS,SINK,Retired,ATCO Power Canada Ltd.,ATPC,,,,,
356,356,BCBC BPC BC IMPORT,BCBC,SOURCE,Retired,BP Canada Energy Company,BPC,,,,,
366,366,BEBC BEML BC IMPORT,BEBC,SOURCE,Retired,Brookfield Energy Marketing LP,BEML,,,,,
370,370,BEXB BEML BC EXPORT,BEXB,SINK,Retired,Brookfield Energy Marketing LP,BEML,,,,,
426,426,BPBC BC IMPORT UNIT,BPBC,SOURCE,Retired,Bonneville Power Adm.,BPA,,,,,
429,429,BPE1 BPA EXPORT TO BCH,BPE1,SINK,Retired,Bonneville Power Adm.,BPA,,,,,
431,431,BPA IMPORT FROM BCH,BPI1,SOURCE,Retired,Bonneville Power Adm.,BPA,,,,,
432,432,BPSK BPC SASK IMPORT,BPSK,SOURCE,Retired,BP Canada Energy Company,BPC,,,,,
434,434,BPXB BP BC EXPORT,BPXB,SINK,Retired,BP Canada Energy Company,BPC,,,,,
435,435,BPXS BP SASK EXPORT,BPXS,SINK,Retired,BP Canada Energy Company,BPC,,,,,
444,444,BRBC ETML BC IMPORT,BRBC,SOURCE,Active,Evolugen Trading and Marketing LP,ETML,,,,,
453,453,BRMT ETML MT IMPORT,BRMT,SOURCE,Active,Evolugen Trading and Marketing LP,ETML,,,,,
455,455,BRSK ETML SK IMPORT,BRSK,SOURCE,Active,Evolugen Trading and Marketing LP,ETML,,,,,
457,457,BRXB ETML BC EXPORT,BRXB,SINK,Active,Evolugen Trading and Marketing LP,ETML,,,,,
458,458,BRXM ETML MT EXPORT,BRXM,SINK,Active,Evolugen Trading and Marketing LP,ETML,,,,,
459,459,BRXS ETML SK EXPORT,BRXS,SINK,Active,Evolugen Trading and Marketing LP,ETML,,,,,
475,475,CABC CETC BC IMPORT,CABC,SOURCE,Retired,Cargill Energy Trading Canada Inc.,CETC,,,,,
479,479,CAMT CETC MT IMPORT,CAMT,SOURCE,Retired,Cargill Energy Trading Canada Inc.,CETC,,,,,
482,482,CASK CETC SK IMPORT,CASK,SOURCE,Retired,Cargill Energy Trading Canada Inc.,CETC,,,,,
483,483,CAXB CETC BC EXPORT,CAXB,SINK,Retired,Cargill Energy Trading Canada Inc.,CETC,,,,,
484,484,CAXM CETC MT EXPORT,CAXM,SINK,Retired,Cargill Energy Trading Canada Inc.,CETC,,,,,
485,485,CAXS CETC SK EXPORT,CAXS,SINK,Retired,Cargill Energy Trading Canada Inc.,CETC,,,,,
494,494,CCBC BC IMPORT UNIT,CCBC,SOURCE,Retired,ENMAX Energy Corporation,EEC,,,,,
499,499,CCE1 ENMAX BCH EXPORT,CCE1,SINK,Retired,ENMAX Energy Corporation,EEC,,,,,
500,500,CCE2 ENMAX SPC EXPORT,CCE2,SINK,Retired,ENMAX Energy Corporation,EEC,,,,,
505,505,CCES IMPORT FROM BCH,CCI1,SOURCE,Retired,Enmax Corporation,CCES,,,,,
511,511,CCSK ENMAX IMPORT SASK,CCSK,SOURCE,Retired,ENMAX Energy Corporation,EEC,,,,,
512,512,CCXB CECO BC EXPORT,CCXB,SINK,Retired,Candela Energy Corporation,CECO,,,,,
525,525,CEBC CANDELA BC IMPORT,CEBC,SOURCE,Retired,Candela Energy Corporation,CECO,,,,,
534,534,CESK CANDELA SASK IMPORT,CESK,SOURCE,Retired,Candela Energy Corporation,CECO,,,,,
535,535,CEXB CECI BC EXPORT,CEXB,SINK,Retired,Coral Energy Canada Inc.,CECI,,,,,
548,548,CGBC CGEC BC IMPORT,CGBC,SOURCE,Retired,Citigroup Energy Canada ULC,CGEC,,,,,
553,553,CGMT CGEC MT IMPORT,CGMT,SOURCE,Retired,Citigroup Energy Canada ULC,CGEC,,,,,
556,556,CGSK CGEC SASK IMPORT,CGSK,SOURCE,Retired,Citigroup Energy Canada ULC,CGEC,,,,,
557,557,CGXB CGEC BC EXPORT,CGXB,SINK,Retired,Citigroup Energy Canada ULC,CGEC,,,,,
558,558,CGXM CGEC MT EXPORT,CGXM,SINK,Retired,Citigroup Energy Canada ULC,CGEC,,,,,
559,559,CGXS CGEC SASK EXPORT,CGXS,SINK,Retired,Citigroup Energy Canada ULC,CGEC,,,,,
576,576,CIMB CECI BC IMPORT,CIMB,SOURCE,Retired,Coral Energy Canada Inc.,CECI,,,,,
577,577,CISK CECI SK IMPORT,CISK,SOURCE,Retired,Coral Energy Canada Inc.,CECI,,,,,
578,578,CIXS CECI SK EXPORT,CIXS,SINK,Retired,Coral Energy Canada Inc.,CECI,,,,,
632,632,CPBC CESC IMPORT FROM BC,CPBC,SOURCE,Retired,Calpine Energy Services Canada,CESC,,,,,
640,640,CPXB CESC EXPORT TO BC,CPXB,SINK,Retired,Calpine Energy Services Canada,CESC,,,,,
672,672,CSBC CONS IMPORT FROM BC,CSBC,SOURCE,Active,"Constellation Energy Generation, LLC",CONS,,,,,
674,674,CSMT CONS IMPORT,CSMT,SOURCE,Active,"Constellation Energy Generation, LLC",CONS,,,,,
675,675,CSSK CONS IMPORT FROM SASK,CSSK,SOURCE,Active,"Constellation Energy Generation, LLC",CONS,,,,,
676,676,CSXB CONS EXPORT TO BC,CSXB,SINK,Active,"Constellation Energy Generation, LLC",CONS,,,,,
677,677,CSXM CONS EXPORT,CSXM,SINK,Active,"Constellation Energy Generation, LLC",CONS,,,,,
678,678,CSXS CONS EXPORT TO SASK,CSXS,SINK,Active,"Constellation Energy Generation, LLC",CONS,,,,,
685,685,CWBC CAWP BC IMPORT,CWBC,SOURCE,Active,CWP Energy Inc.,CAWP,,,,,
686,686,CWMT CAWP MT IMPORT,CWMT,SOURCE,Active,CWP Energy Inc.,CAWP,,,,,
688,688,CWSK CAWP SK IMPORT,CWSK,SOURCE,Active,CWP Energy Inc.,CAWP,,,,,
689,689,CWXB CAWP EXPORT,CWXB,SINK,Active,CWP Energy Inc.,CAWP,,,,,
690,690,CWXM CAWP MT EXPORT,CWXM,SINK,Active,CWP Energy Inc.,CAWP,,,,,
691,691,CWXS CAWP SK EXPORT,CWXS,SINK,Active,CWP Energy Inc.,CAWP,,,,,
717,717,DCBC DCI BC IMPORT,DCBC,SOURCE,Retired,Dynegy Canada Marketing&Trade,DCI,,,,,
720,720,DCSK DCI SASK IMPORT,DCSK,SOURCE,Retired,Dynegy Canada Marketing&Trade,DCI,,,,,
721,721,DCXB DCI BC EXPORT,DCXB,SINK,Retired,Dynegy Canada Marketing&Trade,DCI,,,,,
722,722,DCXS DCI SASK EXPORT,DCXS,SINK,Retired,Dynegy Canada Marketing&Trade,DCI,,,,,
729,729,DEBC BC IMPORT UNIT,DEBC,SOURCE,Retired,Duke Energy Marketing LP,DEM,,,,,
744,744,DESK SASK IMPORT UNIT,DESK,SOURCE,Retired,Duke Energy Marketing LP,DEM,,,,,
752,752,DMBC DEMI IMPORT FROM BC,DMBC,SOURCE,Active,Direct Energy Marketing Limited 2,DEMI,,,,,
754,754,DMMT DEMI MT IMPORT,DMMT,SOURCE,Active,Direct Energy Marketing Limited 2,DEMI,,,,,
755,755,DMXB DEMI EXPORT TO BC,DMXB,SINK,Active,Direct Energy Marketing Limited 2,DEMI,,,,,
756,756,DMXM DEMI MT EXPORT,DMXM,SINK,Active,Direct Energy Marketing Limited 2,DEMI,,,,,
809,809,DYBC DYNS BC IMPORT,DYBC,SOURCE,Active,Dynasty Power Inc. 2,DYNS,,,,,
810,810,DYMT DYNS MT IMPORT,DYMT,SOURCE,Active,Dynasty Power Inc. 2,DYNS,,,,,
811,811,DYSK DYNS SK IMPORT,DYSK,SOURCE,Active,Dynasty Power Inc. 2,DYNS,,,,,
812,812,DYXB DYNS BC EXPORT,DYXB,SINK,Active,Dynasty Power Inc. 2,DYNS,,,,,
813,813,DYXM DYNS MT EXPORT,DYXM,SINK,Active,Dynasty Power Inc. 2,DYNS,,,,,
814,814,DYXS DYNS SK EXPORT,DYXS,SINK,Active,Dynasty Power Inc. 2,DYNS,,,,,
868,868,EABC BC IMPORT UNIT,EABC,SOURCE,Retired,ESBI Alberta Ltd.,EAL,,,,,
916,916,ECBC ENCR BC IMPORT,ECBC,SOURCE,Active,CP Energy Marketing L.P.,ENCR,,,,,
919,919,ECMT ENCR MT IMPORT,ECMT,SOURCE,Active,CP Energy Marketing L.P.,ENCR,,,,,
922,922,ECSK ENCR SASK IMPORT UNIT,ECSK,SOURCE,Active,CP Energy Marketing L.P.,ENCR,,,,,
930,930,BC IMPORT UNIT,EDBC,SOURCE,Retired,EPCOR Distribution Inc.,EPD,,,,,
932,932,EPD IMPORTER ON BCH #0,EDI0,SOURCE,Retired,EPCOR Distribution Inc.,EPD,,,,,
933,933,EPD IMPORTER ON BCH #1,EDI1,SOURCE,Retired,EPCOR Distribution Inc.,EPD,,,,,
934,934,EPD IMPORTER ON SPC #4,EDI4,SOURCE,Retired,EPCOR Distribution Inc.,EPD,,,,,
935,935,EPD IMPORTER ON SPC #5,EDI5,SOURCE,Retired,EPCOR Distribution Inc.,EPD,,,,,
936,936,SASK IMPORT UNIT,EDSK,SOURCE,Retired,EPCOR Distribution Inc.,EPD,,,,,
937,937,EPD EXPORTER ON BCH #0,EDX0,SINK,Retired,EPCOR Distribution Inc.,EPD,,,,,
938,938,EPD EXPORTER ON BCH #1,EDX1,SINK,Retired,EPCOR Distribution Inc.,EPD,,,,,
939,939,EPD EXPORTER ON SPC #4,EDX4,SINK,Retired,EPCOR Distribution Inc.,EPD,,,,,
940,940,EPD EXPORTER ON SPC #5,EDX5,SINK,Retired,EPCOR Distribution Inc.,EPD,,,,,
1008,1008,EEBC EEMI BC IMPORT,EEBC,SOURCE,Active,ENMAX Energy Marketing Inc.,EEMI,,,,,
1023,1023,EEMT EEMI MT IMPORT,EEMT,SOURCE,Active,ENMAX Energy Marketing Inc.,EEMI,,,,,
1043,1043,EESK EEMI SASK IMPORT,EESK,SOURCE,Active,ENMAX Energy Marketing Inc.,EEMI,,,,,
1044,1044,EEXB EEMI BC EXPORT,EEXB,SINK,Active,ENMAX Energy Marketing Inc.,EEMI,,,,,
1045,1045,EEXM EEMI MT EXPORT,EEXM,SINK,Active,ENMAX Energy Marketing Inc.,EEMI,,,,,
1046,1046,EEXS EEMI SASK EXPORT,EEXS,SINK,Active,ENMAX Energy Marketing Inc.,EEMI,,,,,
1047,1047,EGBC EGLE IMPORT BC,EGBC,SOURCE,Active,"EDF Trading North America, LLC",EGLE,,,,,
1051,1051,EGMT EGLE MT IMPORT,EGMT,SOURCE,Active,"EDF Trading North America, LLC",EGLE,,,,,
1055,1055,EGXB EGLE EXPORT BC,EGXB,SINK,Active,"EDF Trading North America, LLC",EGLE,,,,,
1056,1056,EGXM EGLE MT EXPORT,EGXM,SINK,Active,"EDF Trading North America, LLC",EGLE,,,,,
1068,1068,ELBC EL PASO BC IMPORT UNIT,ELBC,SOURCE,Retired,"El Paso Merchant Energy, L.P.",EPME,,,,,
1072,1072,ELSK EL PASO SASK IMPORT UNIT,ELSK,SOURCE,Retired,"El Paso Merchant Energy, L.P.",EPME,,,,,
1073,1073,ELXB EPME BCH EXPORT UNIT,ELXB,SINK,Retired,"El Paso Merchant Energy, L.P.",EPME,,,,,
1074,1074,ELXS EPME SASK EXPORT UNIT,ELXS,SINK,Retired,"El Paso Merchant Energy, L.P.",EPME,,,,,
1100,1100,EMXB ENCR BC EXPORT,EMXB,SINK,Active,CP Energy Marketing L.P.,ENCR,,,,,
1101,1101,EMXM ENCR MT EXPORT,EMXM,SINK,Active,CP Energy Marketing L.P.,ENCR,,,,,
1102,1102,EMXS ENCR SK EXPORT,EMXS,SINK,Active,CP Energy Marketing L.P.,ENCR,,,,,
1114,1114,ENBC BC IMPORT UNIT,ENBC,SOURCE,Retired,Enron Canada Corporation,ENR,,,,,
1127,1127,ENR EXPORT TO BCH,ENE0,SINK,Retired,Enron Canada Corporation,ENR,,,,,
1128,1128,ENE1 ENRON BCH EXPORT,ENE1,SINK,Retired,Enron Canada Corporation,ENR,,,,,
1129,1129,ENE2 ENRON SPC EXPORT,ENE2,SINK,Retired,Enron Canada Corporation,ENR,,,,,
1130,1130,ENE4 ENR BCH EXPORT,ENE4,SINK,Retired,Enron Canada Corporation,ENR,,,,,
1131,1131,ENE5 ENR BCH EXPORT,ENE5,SINK,Retired,Enron Canada Corporation,ENR,,,,,
1132,1132,ENE6 ENR BCH EXPORT,ENE6,SINK,Retired,Enron Canada Corporation,ENR,,,,,
1133,1133,ENE7 ENR BCH EXPORT,ENE7,SINK,Retired,Enron Canada Corporation,ENR,,,,,
1134,1134,ENR EXPORT TO BCH,ENE8,SINK,Retired,Enron Canada Corporation,ENR,,,,,
1135,1135,ENR EXPORT TO BCH,ENE9,SINK,Retired,Enron Canada Corporation,ENR,,,,,
1136,1136,ENEA ENR BCH EXPORT,ENEA,SINK,Retired,Enron Canada Corporation,ENR,,,,,
1137,1137,ENEB ENR BCH EXPORT,ENEB,SINK,Retired,Enron Canada Corporation,ENR,,,,,
1142,1142,ENR IMPORT FROM BCH,ENI0,SOURCE,Retired,Enron Canada Corporation,ENR,,,,,
1143,1143,ENR IMPORT FROM BCH,ENI1,SOURCE,Retired,Enron Canada Corporation,ENR,,,,,
1144,1144,ENR IMPORT FROM BCH,ENI2,SOURCE,Retired,Enron Canada Corporation,ENR,,,,,
1145,1145,ENR IMPORT FROM BCH,ENI3,SOURCE,Retired,Enron Canada Corporation,ENR,,,,,
1146,1146,ENR IMPORT FROM BCH,ENI4,SOURCE,Retired,Enron Canada Corporation,ENR,,,,,
1147,1147,ENR IMPORT FROM BCH,ENI5,SOURCE,Retired,Enron Canada Corporation,ENR,,,,,
1148,1148,ENR IMPORT FROM BCH,ENI6,SOURCE,Retired,Enron Canada Corporation,ENR,,,,,
1149,1149,ENR IMPORT FROM BCH,ENI7,SOURCE,Retired,Enron Canada Corporation,ENR,,,,,
1150,1150,ENR IMPORT FROM BCH,ENI8,SOURCE,Retired,Enron Canada Corporation,ENR,,,,,
1151,1151,ENR IMPORT FROM BCH,ENI9,SOURCE,Retired,Enron Canada Corporation,ENR,,,,,
1152,1152,ENR IMPORT FROM SPC,ENIA,SOURCE,Retired,Enron Canada Corporation,ENR,,,,,
1159,1159,ENSK SASK IMPORT UNIT,ENSK,SOURCE,Retired,Enron Canada Corporation,ENR,,,,,
1185,1185,EP EXPORT #1 ON BCH TIE,EPEX,SINK,Retired,EPCOR Energy Services Inc.,EP,,,,,
1187,1187,EP IMPORT FROM BCH,EPI2,SOURCE,Retired,EPCOR Energy Services Inc.,EP,,,,,
1188,1188,EP IMPORT FROM BCH,EPI3,SOURCE,Retired,EPCOR Energy Services Inc.,EP,,,,,
1189,1189,EP IMPORT FROM BCH,EPI4,SOURCE,Retired,EPCOR Energy Services Inc.,EP,,,,,
1190,1190,EP IMPORT FROM BCH,EPI5,SOURCE,Retired,EPCOR Energy Services Inc.,EP,,,,,
1191,1191,EP IMPORT FROM BCH,EPI6,SOURCE,Retired,EPCOR Energy Services Inc.,EP,,,,,
1192,1192,EP IMPORT FROM BCH,EPIM,SOURCE,Retired,EPCOR Energy Services Inc.,EP,,,,,
1196,1196,EPMT PPLE MT IMPORT,EPMT,SOURCE,Retired,"Talen Energy Marketing, LLC",PPLE,,,,,
1209,1209,EP EXPORT ON BCH TIE,EPX2,SINK,Retired,EPCOR Energy Services Inc.,EP,,,,,
1210,1210,EP EXPORT ON BCH TIE,EPX3,SINK,Retired,EPCOR Energy Services Inc.,EP,,,,,
1211,1211,EP EXPORT ON BCH TIE,EPX4,SINK,Retired,EPCOR Energy Services Inc.,EP,,,,,
1212,1212,EP EXPORT ON BCH TIE,EPX5,SINK,Retired,EPCOR Energy Services Inc.,EP,,,,,
1213,1213,EP EXPORT ON BCH TIE,EPX6,SINK,Retired,EPCOR Energy Services Inc.,EP,,,,,
1214,1214,EPXM PPLE MT EXPORT,EPXM,SINK,Retired,"Talen Energy Marketing, LLC",PPLE,,,,,
1246,1246,ESBC TCES BC IMPORT,ESBC,SOURCE,Active,TransCanada Energy Sales Ltd.,TCES,,,,,
1249,1249,ESMT MT IMPORT,ESMT,SOURCE,Active,TransCanada Energy Sales Ltd.,TCES,,,,,
1253,1253,ESSK TCES SASK IMPORT,ESSK,SOURCE,Active,TransCanada Energy Sales Ltd.,TCES,,,,,
1255,1255,ESXB TCES BC EXPORT,ESXB,SINK,Active,TransCanada Energy Sales Ltd.,TCES,,,,,
1256,1256,ESXM MT EXPORT,ESXM,SINK,Active,TransCanada Energy Sales Ltd.,TCES,,,,,
1257,1257,ESXS TCES SASK EXPORT,ESXS,SINK,Active,TransCanada Energy Sales Ltd.,TCES,,,,,
1769,1769,IEBC IPC BC EXPORT UNIT,IEBC,SINK,Retired,IDACORP Energy L.P.,IPC,,,,,
1770,1770,IESK IPC SASK EXPORT UNIT,IESK,SINK,Retired,IDACORP Energy L.P.,IPC,,,,,
1778,1778,IPBC BC IMPORT UNIT,IPBC,SOURCE,Retired,IDACORP Energy L.P.,IPC,,,,,
1806,1806,ISBC PPOA IMPORT BC,ISBC,SOURCE,Active,AESO - Market,PPOA,,,,,
1807,1807,ISXB PPOA EXPORT BC,ISXB,SINK,Active,AESO - Market,PPOA,,,,,
1848,1848,LBBC LBCS BC IMPORT,LBBC,SOURCE,Retired,Lehman Brothers Commodity Services Inc.,LBCS,,,,,
1850,1850,LBSK LBCS SASK IMPORT,LBSK,SOURCE,Retired,Lehman Brothers Commodity Services Inc.,LBCS,,,,,
1851,1851,LBXB LBCS BC EXPORT,LBXB,SINK,Retired,Lehman Brothers Commodity Services Inc.,LBCS,,,,,
1852,1852,LBXS LBCS SASK EXPORT,LBXS,SINK,Retired,Lehman Brothers Commodity Services Inc.,LBCS,,,,,
1854,1854,DLD EXPORT #1 - BCH,LDE1,SINK,Retired,Duke/Louis Dreyfus L.L.C.,DLD,,,,,
1855,1855,DLD EXPORT #2 - PWX,LDE2,SINK,Retired,Duke/Louis Dreyfus L.L.C.,DLD,,,,,
1856,1856,DLD EXPORT #3 - SK,LDE3,SINK,Retired,Duke/Louis Dreyfus L.L.C.,DLD,,,,,
1857,1857,DLD IMPORT #1 - BCH,LDI1,SOURCE,Retired,Duke/Louis Dreyfus L.L.C.,DLD,,,,,
1858,1858,DLD IMPORT #2 - PWX,LDI2,SOURCE,Retired,Duke/Louis Dreyfus L.L.C.,DLD,,,,,
1859,1859,DLD IMPORT #3 - SK,LDI3,SOURCE,Retired,Duke/Louis Dreyfus L.L.C.,DLD,,,,,
1931,1931,MABC MANH IMPORT FROM BC,MABC,SOURCE,Retired,Manitoba Hydro,MANH,,,,,
1935,1935,MASK IMPORT FROM SASK,MASK,SOURCE,Active,Manitoba Hydro,MANH,,,,,
1936,1936,MAXB MANH EXPORT TO BC,MAXB,SINK,Retired,Manitoba Hydro,MANH,,,,,
1937,1937,MAXS EXPORT TO SASK,MAXS,SINK,Active,Manitoba Hydro,MANH,,,,,
1944,1944,MCXB MCLE EXPORT TO BC,MCXB,SINK,Retired,Brookfield Energy Marketing Inc.,MCLE,,,,,
1966,1966,MFBC MFTP BC IMPORT,MFBC,SOURCE,Active,MFT Energy US Power LLC,MFTP,,,,,
1968,1968,MFMT MFTP MT IMPORT,MFMT,SOURCE,Active,MFT Energy US Power LLC,MFTP,,,,,
1970,1970,MFSK MFTP SK IMPORT,MFSK,SOURCE,Active,MFT Energy US Power LLC,MFTP,,,,,
1971,1971,MFXB MFTP BC EXPORT,MFXB,SINK,Active,MFT Energy US Power LLC,MFTP,,,,,
1972,1972,MFXM MFTP MT EXPORT,MFXM,SINK,Active,MFT Energy US Power LLC,MFTP,,,,,
1973,1973,MFXS MFTP SK EXPORT,MFXS,SINK,Active,MFT Energy US Power LLC,MFTP,,,,,
1976,1976,MGBC MAGE BC IMPORT,MGBC,SOURCE,Active,MAG Energy Solutions Inc.,MAGE,,,,,
1979,1979,MGMT MAG MT IMPORT,MGMT,SOURCE,Active,MAG Energy Solutions Inc.,MAGE,,,,,
1980,1980,MGSK MAG SK IMPORT,MGSK,SOURCE,Active,MAG Energy Solutions Inc.,MAGE,,,,,
1981,1981,MGXB MAGE BC EXPORT,MGXB,SINK,Active,MAG Energy Solutions Inc.,MAGE,,,,,
1982,1982,MGXM MAG MT EXPORT,MGXM,SINK,Active,MAG Energy Solutions Inc.,MAGE,,,,,
1983,1983,MGXS MAG SK EXPORT,MGXS,SINK,Active,MAG Energy Solutions Inc.,MAGE,,,,,
1994,1994,MLBC MLCC BC IMPORT,MLBC,SOURCE,Retired,Merrill Lynch Commodities Canada,MLCC,,,,,
1999,1999,MLSK MLCC SASK IMPORT,MLSK,SOURCE,Retired,Merrill Lynch Commodities Canada,MLCC,,,,,
2000,2000,MLXB MLCC BC EXPORT,MLXB,SINK,Retired,Merrill Lynch Commodities Canada,MLCC,,,,,
2001,2001,MLXS MLCC SASK EXPORT,MLXS,SINK,Retired,Merrill Lynch Commodities Canada,MLCC,,,,,
2012,2012,MOBC MSCG IMPORT FROM BC,MOBC,SOURCE,Active,Morgan Stanley Capital Group Inc.,MSCG,,,,,
2015,2015,MOMT MT IMPORT,MOMT,SOURCE,Active,Morgan Stanley Capital Group Inc.,MSCG,,,,,
2018,2018,MOSK MSCG IMPORT FROM SASK,MOSK,SOURCE,Active,Morgan Stanley Capital Group Inc.,MSCG,,,,,
2019,2019,MOXB MSCG EXPORT TO BC,MOXB,SINK,Active,Morgan Stanley Capital Group Inc.,MSCG,,,,,
2020,2020,MOXM MT EXPORT,MOXM,SINK,Active,Morgan Stanley Capital Group Inc.,MSCG,,,,,
2021,2021,MOXS MSCG EXPORT TO SASK,MOXS,SINK,Active,Morgan Stanley Capital Group Inc.,MSCG,,,,,
2026,2026,MQBC MQEC BC IMPORT,MQBC,SOURCE,Active,Macquarie Energy Canada Ltd.,MQEC,,,,,
2027,2027,MQMT MQEC MT IMPORT,MQMT,SOURCE,Active,Macquarie Energy Canada Ltd.,MQEC,,,,,
2028,2028,MQSK MQEC SK IMPORT,MQSK,SOURCE,Active,Macquarie Energy Canada Ltd.,MQEC,,,,,
2029,2029,MQXB MQEC BC EXPORT,MQXB,SINK,Active,Macquarie Energy Canada Ltd.,MQEC,,,,,
2030,2030,MQXM MQEC MT EXPORT,MQXM,SINK,Active,Macquarie Energy Canada Ltd.,MQEC,,,,,
2031,2031,MQXS MQEC SK EXPORT,MQXS,SINK,Active,Macquarie Energy Canada Ltd.,MQEC,,,,,
2062,2062,NABC NAGP BC IMPORT,NABC,SOURCE,Retired,Noble Americas Gas & Power Corp.,NAGP,,,,,
2065,2065,NAMT NAGP MT IMPORT,NAMT,SOURCE,Retired,Noble Americas Gas & Power Corp.,NAGP,,,,,
2066,2066,NASK NAGP SASK IMPORT,NASK,SOURCE,Retired,Noble Americas Gas & Power Corp.,NAGP,,,,,
2068,2068,NAXB NAGP BC EXPORT,NAXB,SINK,Retired,Noble Americas Gas & Power Corp.,NAGP,,,,,
2069,2069,NAXM NAGP MT EXPORT,NAXM,SINK,Retired,Noble Americas Gas & Power Corp.,NAGP,,,,,
2070,2070,NAXS NAGP SASK EXPORT,NAXS,SINK,Retired,Noble Americas Gas & Power Corp.,NAGP,,,,,
2140,2140,NXBC NXI BC IMPORT,NXBC,SOURCE,Inactive,CNOOC Petroleum North America ULC,NXI,,,,,
2144,2144,NXSK NXI SASK IMPORT,NXSK,SOURCE,Inactive,CNOOC Petroleum North America ULC,NXI,,,,,
2145,2145,NXXB NXI BC EXPORT,NXXB,SINK,Inactive,CNOOC Petroleum North America ULC,NXI,,,,,
2146,2146,NXXS NXI SASK EXPORT,NXXS,SINK,Inactive,CNOOC Petroleum North America ULC,NXI,,,,,
2161,2161,OPBC OPGI BC IMPORT,OPBC,SOURCE,Active,Ontario Power Generation Inc.,OPGI,,,,,
2162,2162,OPMT OPGI MT IMPORT,OPMT,SOURCE,Active,Ontario Power Generation Inc.,OPGI,,,,,
2163,2163,OPSK OPGI SK IMPORT,OPSK,SOURCE,Active,Ontario Power Generation Inc.,OPGI,,,,,
2164,2164,OPXB OPGI BC EXPORT,OPXB,SINK,Active,Ontario Power Generation Inc.,OPGI,,,,,
2165,2165,OPXM OPGI MT EXPORT,OPXM,SINK,Active,Ontario Power Generation Inc.,OPGI,,,,,
2166,2166,OPXS OPGI SK EXPORT,OPXS,SINK,Active,Ontario Power Generation Inc.,OPGI,,,,,
2197,2197,PACIFICORP IMPORT FROM BC,PCI1,SOURCE,Retired,PacifiCorp,PCFC,,,,,
2203,2203,PACIFICORP EXPORT TO BCH,PCX1,SINK,Retired,PacifiCorp,PCFC,,,,,
2206,2206,PEBC BPEG BC IMPORT,PEBC,SOURCE,Active,BP Canada Energy Group ULC,BPEG,,,,,
2211,2211,PESK BPEG SK IMPORT,PESK,SOURCE,Active,BP Canada Energy Group ULC,BPEG,,,,,
2212,2212,PEXB BPEG BC EXPORT,PEXB,SINK,Active,BP Canada Energy Group ULC,BPEG,,,,,
2213,2213,PEXS BPEG SK EXPORT,PEXS,SINK,Active,BP Canada Energy Group ULC,BPEG,,,,,
2216,2216,PGBC BC IMPORT UNIT,PGBC,SOURCE,Retired,PG & E Energy Trading,PGET,,,,,
2221,2221,PGAE EXPORT TO BCH #1,PGE0,SINK,Retired,PG & E Energy Trading ,PGET,,,,,
2222,2222,PGE1 PGAE BCH EXPORT 1,PGE1,SINK,Retired,PG & E Energy Trading,PGET,,,,,
2223,2223,PGE2 PGAE BCH EXPORT 2,PGE2,SINK,Retired,PG & E Energy Trading ,PGET,,,,,
2224,2224,PGE3 PGAE BCH EXPORT 3,PGE3,SINK,Retired,PG & E Energy Trading ,PGET,,,,,
2225,2225,PGE4 PGAE BCH EXPORT 4,PGE4,SINK,Retired,PG & E Energy Trading ,PGET,,,,,
2226,2226,PGE5 PGAE BCH EXPORT 5,PGE5,SINK,Retired,PG & E Energy Trading ,PGET,,,,,
2227,2227,PGE6 PGAE BCH EXPORT 6,PGE6,SINK,Retired,PG & E Energy Trading ,PGET,,,,,
2228,2228,PGE7 PGAE BCH EXPORT 7,PGE7,SINK,Retired,PG & E Energy Trading ,PGET,,,,,
2229,2229,PGAE EXPORT TO BCH #9,PGE8,SINK,Retired,PG & E Energy Trading ,PGET,,,,,
2230,2230,PGAE EXPORT TO BCH #10,PGE9,SINK,Retired,PG & E Energy Trading ,PGET,,,,,
2231,2231,PGEA PGAE SPC EXPORT 1,PGEA,SINK,Retired,PG & E Energy Trading,PGET,,,,,
2232,2232,PGEB PGAE SPC EXPORT 2,PGEB,SINK,Retired,PG & E Energy Trading ,PGET,,,,,
2233,2233,PGEC PGAE SPC EXPORT 3,PGEC,SINK,Retired,PG & E Energy Trading ,PGET,,,,,
2234,2234,PGED PGAE SPC EXPORT 4,PGED,SINK,Retired,PG & E Energy Trading ,PGET,,,,,
2235,2235,PGEE PGAE SPC EXPORT 5,PGEE,SINK,Retired,PG & E Energy Trading ,PGET,,,,,
2236,2236,PGEF PGAE SPC EXPORT 6,PGEF,SINK,Retired,PG & E Energy Trading ,PGET,,,,,
2237,2237,PGEG PGAE SPC EXPORT 7,PGEG,SINK,Retired,PG & E Energy Trading ,PGET,,,,,
2238,2238,PGAE EXPORT TO SPC #8,PGEH,SINK,Retired,PG & E Energy Trading ,PGET,,,,,
2239,2239,PGAE EXPORT TO SPC #9,PGEI,SINK,Retired,PG & E Energy Trading ,PGET,,,,,
2240,2240,PGAE EXPORT TO SPC #10,PGEJ,SINK,Retired,PG & E Energy Trading ,PGET,,,,,
2241,2241,PGAE IMPORT FROM BCH #1,PGI0,SOURCE,Retired,PG & E Energy Trading ,PGET,,,,,
2242,2242,PGAE IMPORT FROM BCH #2,PGI1,SOURCE,Retired,PG & E Energy Trading ,PGET,,,,,
2243,2243,PGAE IMPORT FROM BCH #3,PGI2,SOURCE,Retired,PG & E Energy Trading ,PGET,,,,,
2244,2244,PGAE IMPORT FROM BCH #4,PGI3,SOURCE,Retired,PG & E Energy Trading ,PGET,,,,,
2245,2245,PGAE IMPORT FROM BCH #5,PGI4,SOURCE,Retired,PG & E Energy Trading ,PGET,,,,,
2246,2246,PGAE IMPORT FROM BCH #6,PGI5,SOURCE,Retired,PG & E Energy Trading ,PGET,,,,,
2247,2247,PGAE IMPORT FROM BCH #7,PGI6,SOURCE,Retired,PG & E Energy Trading ,PGET,,,,,
2248,2248,PGAE IMPORT FROM BCH #8,PGI7,SOURCE,Retired,PG & E Energy Trading ,PGET,,,,,
2249,2249,PGAE IMPORT FROM BCH #9,PGI8,SOURCE,Retired,PG & E Energy Trading ,PGET,,,,,
2250,2250,PGAE IMPORT FROM BCH #10,PGI9,SOURCE,Retired,PG & E Energy Trading ,PGET,,,,,
2251,2251,PGAE IMPORT FROM SPC #1,PGIA,SOURCE,Retired,PG & E Energy Trading ,PGET,,,,,
2252,2252,PGAE IMPORT FROM SPC #2,PGIB,SOURCE,Retired,PG & E Energy Trading ,PGET,,,,,
2253,2253,PGAE IMPORT FROM SPC #3,PGIC,SOURCE,Retired,PG & E Energy Trading ,PGET,,,,,
2254,2254,PGAE IMPORT FROM SPC #4,PGID,SOURCE,Retired,PG & E Energy Trading ,PGET,,,,,
